Trivikram Srinivas,"After his directorial debut Nuvve Nuvve won the Nandi Award for Best Feature Film, Srinivas directed the Pawan Kalyan-starrer Attarintiki Daredi, which was the highest grosser of the Telugu film industry in 2013",21.5,https://www.forbesindia.com/media/celeblist2019/big/077_Trivikram-srinivas.jpg,1,Filmmaker,"Trivikram Srinivas, a former advertising professional, is a low-profile director despite working with some of the biggest superstars of the Telugu film industry. His presence in the list is the result of his ambitious action drama called Aravinda Sametha Veera Raghava, starring Junior NTR. The director's estimated earnings from this film alone stand at Rs 21. 5 crore. Srinivas has received seven Nandi Awards, an honour conferred by the Andhra Pradesh government for excellence in Telugu cinema. ",Films
Ali Abbas Zafar,The blockbuster success of Sultan,15,https://www.forbesindia.com/media/celeblist2019/big/078_Ali Abbas Zafar.jpg,1,Director and Screenwriter," Ali Abbas Zafar made his directorial debut in 2011 with Mere Brother Ki Dulhan and then went on to make Gunday in 2014. In 2016, he directed the Salman Khan-starrer Sultan, which had a worldwide collection of Rs 614.49 crore. Following that he directed Tiger Zinda Hai and his latest hit was Bharat, which made Rs 325.58 crore worldwide. ",Films
Divyanka Tripathi Dahiya ,Winning three awards for her role in the TV show Yeh Hai Mohabbatein,1.46,https://www.forbesindia.com/media/celeblist2019/big/079_Divyanka Tripathi Dahiya.jpg,3,TV personality,"Divyanka Tripathi Dahiya has been a household face for more than a decade, portraying different roles in numerous TV serials. Despite a plummet in earnings from Rs 7.8 crore last year to Rs 1.46 crore now, her fame quotient substantially pushed her higher on the list. Her role as Dr Ishita Bhalla in the TV show Yeh Hai Mohabbatein is popular, and has won her multiple awards.","TV, Endorsements"
Siva,"The 2011 Tamil film Siruthai starring Karthi and Tamannah, so much so, that the title of the film is often prefixed with Siva's name. The project was a remake of the Telugu film Vikramarkudu directed by SS Rajamouli of Baahubali fame",12.17,https://www.forbesindia.com/media/celeblist2019/big/Face_280X280.jpg,2,Filmmaker,"A gold medalist from the MGR Government Film and Training Institute in Chennai, Siva started out as a cinematographer, Siva sealed his positioning as a director in the Tamil and Telugu film industries. He is known to pick film titles only with the alphabet 'V', thus explaining his previous outings with superstar Ajith Kumar, titled Veeram, Vivegam and Vedalam respectively. His entry into the list is riding on the success of his film Viswasam, for which he earned an estimated Rs 12.17 crore. ,                                
                              
",Films
Saina Nehwal,Won bronze in the 2012 Olympics,3,https://www.forbesindia.com/media/celeblist2019/big/081_Saina Nehwal.jpg,3,Badminton player,"For the Indian shuttler, currently ranked world number 10 in women's singles, 2019 was a lean year. Nehwal started the year strong, sealing a semi-final berth in the Malaysia Masters, followed by a win in the Indonesia Masters, when she got a walk over in the finals as opponent Carolina Marin bowed out with an injury. This was in January. In the next 14 global tournaments she contested during the year, Nehwal made it to the quarters only four times. She, however, beat PV Sindhu to retain her nationals title. Nehwal saw her earnings erode to an estimated Rs 3 crore in 2019 from about Rs 16.5 crore the year before.","Badminton, Endorsements"
Bharti Singh,Singh shot to fame after being judged runner-up in the stand-up comedy reality series The Great Indian Laughter Challenge (Season 4),10.92,https://www.forbesindia.com/media/celeblist2019/big/082_Bharti Singh.jpg,3,Comedian,Singh appeared in a number of reality TV shows in the last year including Fear Factor: Khatron ke Khiladi (season 9) where she made it to the grand finale; Dance Dewane (season 1); and Bigg Boss (season 12). She also hosted India's Got Talent (season 8). All of this has only added to Singh's social media fandom. ,TV
Zoya Akhtar,Gully Boy was India's official entry into the Oscars,9.33,https://www.forbesindia.com/media/celeblist2019/big/083_Zoya Akhtar.jpg,1,Filmmaker,"After directing Ranveer Singh and Alia Bhatt in the widely successful Gully Boy, Akhtar also cut her teeth in the burgeoning business of web television with Made in Heaven on Amazon Prime Video. Gully Boy, which narrates the coming-of-age story of a struggling rapper, was India's official for the Best International Feature Film at the 92nd Academy Awards. It raked in a staggering Rs 238 crore at the box office. Made in Heaven, meanwhile has a rating of 8.3 on IMDb.","Films, OTT"
Karthik Subbaraj ,"Jigarthanda, a commercial and critical success",13.5,https://www.forbesindia.com/media/celeblist2019/big/Face_280X280.jpg,1,Director,"A software engineer, Subbaraj started making short films, before fast emerging as a director that most Tamil superstars are lining up to work with. Apart from Rajinikanth, Subbaraj has also directed stars such as Vijay Sethupathi, Siddharth and Dhanush. In fact, for his next release, Suruli with Dhanush, Subbaraj also managed to sign Game of Thrones star James Cosmo for a pivotal role. The success of Pizza, Subbaraj's first film, helped Vijay Sethupathi emerge as one of Tamil cinema's most sought-after actors. ",Films
Sunil Chhetri,"Between 2007 and 2019, Chhetri has been named player of the year six times by the AIFF",6.1,https://www.forbesindia.com/media/celeblist2019/big/085_Sunil Chhetri.jpg,2,Football,"Sunil Chhetri, 35, captains India's national football team as well as the Bengaluru FC professional football club. Chhetri started his footballing career with Mohun Bagan in 2002, and plays as a striker. His career has included stints overseas in the US and Portugal. Chhetri is the second highest active international goal scorer. He has helped India win the Nehru Cup in 2007, 2009 and 2012, and the SAFF Championship in 2011. ","Football, Endorsements"
Remo D'Souza,National Award for the song 'Deewani Mastani' for Bajirao Mastani (2015),1.63,https://www.forbesindia.com/media/celeblist2019/big/086_Remo D'Souza.jpg,2,"Choreographer, director, actor, reality TV show judge","Choreographer-director Remo D'Souza has just wrapped up his upcoming directorial venture, Street Dancer 3D. He is also working on the third series of the Any Body Can Dance (ABCD) franchise. Last year, D'Souza climbed to No 65, riding on the success of the Salman Khan-starrer Race 3, which was the third-highest grossing film last year, collecting Rs 303 crore worldwide. Apart from directing and choreographing, D'Souza continues his role as a judge and mentor for the reality show, Dance Plus. ","Films, TV"
Mary Kom,Becoming the most successful boxer in the history of the world championships by securing her eighth medal earlier this year,3.9,https://www.forbesindia.com/media/celeblist2019/big/087_Merry Kom.jpg,1,Boxer,"Mary Kom returns to the Forbes India Celebrity 100 list this year, making history at the women's world boxing championships. She became the first boxer to win eight medals. In a career spanning two decades boxer Mary Kom has seen multiple highs. In October this year, the International Olympic Committee (IOC) named her as a female representative of boxing's athlete ambassadors group for the 2020 Tokyo Olympic Games.","Boxing, Endorsements"
Mithali Raj,Raj is the highest run-scorer in women's cricket and is its most capped player,2.63,https://www.forbesindia.com/media/celeblist2019/big/088_ Mithali Raj.jpg,1,Cricketer,"During her 20-year career, Mithali Raj has evoked parallels with Sachin Tendulkar for her prolific run-scoring. At 16, she debuted with an ODI century that set herself up as the cornerstone for Indian batting in the years to come; Raj is not only the highest scorer in the women's cricket but has displayed incredible resilience by being its most capped player as well. The 37-year-old, who has twice captained India within sniffing distance of the ODI World Cup (in 2005 and 2017), has now retired from T20s to focus on winning the 2021 edition. A biopic on Raj starring Taapsee Pannu will go on the floors in the middle of 2020. ","Cricket, Endorsements"
Raveena Tandon,Won the national award for Kalpana Lajmi's Daman in 2001,2.4,https://www.forbesindia.com/media/celeblist2019/big/089 Ravena Tandon.jpg,1,"Actor, TV judge","After several years of inaction, Tandon made a comeback with small roles in movies and television. Her popularity as a judge in the dance reality show Nach Baliye (Season 9) and a cameo in the remix of her 90s hit song 'Shehar ki Ladki' in 2019 movie Khandaani Shafakhana brings her into the Celebrity 100 list. ","TV, Endorsements"
Smriti Mandhana,Won ICC's Woman Cricketer of the Year and Women's ODI Player of the Year in 2018,2.85,https://www.forbesindia.com/media/celeblist2019/big/090_Snriti Mandhana.jpg,1,Cricketer,"Smriti Mandhana has hardly put a foot wrong in our time period, except for a toe injury ahead of India's recent tour of West Indies. She finished year 2018 as ICC's cricketer of the year as well as the women's ODI player of the year, continuing with her good form through the series against New Zealand that followed. Just 23, Mandhana not only became the youngest T20 captain for India when she filled in for an injured Harmanpreet Kaur, she's also leading the field in endorsements, bagging five, the highest for a woman cricket along with Kaur. ","Cricket, Endorsements"
Harmanpreet Kaur,"The innings of 171* in the semifinal of the 2017 ODI World Cup, regarded as among the best ever in women's cricket",2.12,https://www.forbesindia.com/media/celeblist2019/big/091_Harmanpreet Kaur.jpg,1,Cricketer,"The first woman cricketer to hit a T20 century and the first Indian cricketer to be signed by an overseas T20 franchise—Sydney Thunder in 2016—Harmanpreet Kaur was named the captain of the ICC's T20 team of the year in 2018. In October, this wiry six-hitting machine from Punjab became the first Indian cricketer to play 100 T20 internationals, when she took the field against South Africa. Her powerful hitting and her athletic fielding has extricated women's cricket out of gender stereotypes and conferred on her the stature of a gamechanger. ","Cricket, Endorsements"
Karan Kundra,Making a stellar debut as Arjun Punj in Ekta Kapoor's Kitani Mohabbat Hai in 2009,4.12,https://www.forbesindia.com/media/celeblist2019/big/092_Karan Kundra.jpg,2,TV actor,"Best known for his role in Ekta Kapoor's Kitani Mohabbat Hai (2009) and as the host of crime show Gumrah: End of Innocence (2012) on Channel V, Karan Kundra has had a busy year. He hosted MTV Love School (season 3 and 4), played the protagonist in Kapoor's romantic drama Dil Toh Hai (season 1 and 2) and appeared as a guest in Nach Baliye (season 9). ","TV, OTT"
Kalki Koechlin,Playing a young woman with cerebral palsy in Margarita with a Straw in 2014 won her a National Film Award,3.33,https://www.forbesindia.com/media/celeblist2019/big/093_Kalki Koechlin.jpg,1,Actor,"Kalki Koechlin, 35, popular theatre and cinema actor, had recent roles as a documentary filmmaker in the movie Gully Boy, and a lonely socialite in Amazon Prime Video's Made in Heaven, both directed by Zoya Akhtar. Koechlin is the recipient of the National Film Award, the Filmfare Award and two Screen Awards. ","Films, OTT"
Bajrang Punia,"After he won the silver at the 2018 World Wrestling Championships, Punia claimed World No1 in the 65 kg category",2.4,https://www.forbesindia.com/media/celeblist2019/big/094_Bajrang Punjia.jpg,1,Wrestler,"Wrestler Bajrang Punia ranked 94 on the list with earnings of Rs 2.4 crore. Punia, who won the bronze at the 2019 World Wrestling Championships, endorses at least three brands including Mobil, Asics shoes and TT underwear. The Bharat Khel Ratna awardee is India's biggest bet for a medal at the Tokyo 2020 Olympics in the 65-kg weight category.","Wrestling, Endorsements"
Anirban Lahiri,Joining PGA Tour in 2015,5.3,https://www.forbesindia.com/media/celeblist2019/big/095_Anirban Lahiri.jpg,3,Golfer,"Anirban Lahiri had a poor 18 months, resulting in him sliding down on the Forbes India Celebrity 100 List, from No 81 (Rs 11.99 crore) in 2018 to No 95 (Rs 5.3 crore) this year. The golfer struggled with form and lost his PGA Tour card only to reclaim it after finishing fifth (tied) at the Albertson Boise Open in August. With four birdies in five holes, he even made the cut at the RSM Classic in November.",Golf
Ranveer Brar,"Became the country's youngest executive chef at a five-star hotel, at age 25",4.99,https://www.forbesindia.com/media/celeblist2019/big/096_Ranveer Brar.jpg,1,"Chef, Entrepreneur, TV anchor","Ranveer Brar is the second-highest earning celebrity chef on the list, riding on his popular travel-led TV shows Himalayas - The Offbeat Adventure and Chakh Le India. The suave chef started his career at five-star kitchens and later as the head of banquets at the Rashtrapati Bhavan and Prime Minister's Residence. Ranveer Brar is now a popular TV personality on several food shows. In October 2018, Brar premiered a show on Living Foodz (now called LF) called Station Master's Tiffin, which explored India's regional cuisine and sub-cultures along the Indian Railways routes, from the deep hinterland. Brar is among the judges on the newest season of Masterchef India, which began in December 2019. ","TV, Endorsements"
Vikas Khanna,His restaurant Junoon in New York won a Michelin star for six consecutive years,3.75,https://www.forbesindia.com/media/celeblist2019/big/097_Vikas Khanna.jpg,1,"Chef, TV personality, Entrepreneur","Star chef Vikas Khanna, best known for his Michelin-starred Manhattan restaurant Junoon, makes a list debut in the new celebrity chefs category. Born in Amritsar, Vikas Khanna's passion for cooking, inherited from his grandmother, has now placed him in New York. His restaurant Junoon in New York is one of the most sought-after spots for Indian food. The restaurant has received a Michelin star for six consecutive years. Khanna is also a popular face on cooking and food shows on television, which brings him a bunch of brand endorsements. While he didn't have a TV appearance during the considered time period, he is a judge on the now-airing season of Masterchef India, which began in December. ",Endorsements
Rohan Bopanna,Won the 2017 French Open mixed doubles with Gabriela Dabrowski,1.87,https://www.forbesindia.com/media/celeblist2019/big/098_Rohan Bopanna.jpg,2,Tennis player,"India's professional tennis player makes it to the Forbes India Celebrity 100 list once again, the fifth time in eight years. Bopanna has had an active 2018-19 playing several Grand Slam tournaments and ATP Masters Series 1000. With a string of average but consistent performances Bopanna continues to find his way into the list, with earnings also aided by endorsements from Asics for his tennis academy. ","Tennis, Endorsements"
Vicky Ratnani,Was appointed the personal chef to Nelson Mandela on his journey from Durban to Cape Town,2,https://www.forbesindia.com/media/celeblist2019/big/99_Vicky Ratnani_bg.jpg,1,"Chef, TV personality and F&B entrepreneur","With a popular web series, Vicky the Gastronaut, and as the face of food at the lavish Inox Insignia, Chef Vicky Ratnani debuts on the Forbes India Celebrity 100 list this year. The Mumbai chef has crossed seas to follow his dreams, starting his career on a series of world cruises, which exposed him to markets and cuisines across the world. His most recent show is a web series called Vicky the Gastronaut, a travel-based food show that shot its first two seasons in Peru and Australia, and will film its next in Chiang Mai in Thailand. Ratnani also has a health food start-up called Hello Green, and consults with Inox Cinemas' luxury brand, Insignia, for its elaborate menu. ",Endorsements
Saransh Goila,"Appeared as a guest judge on Masterchef Australia, the first Indian chef to do so",1.41,https://www.forbesindia.com/media/celeblist2019/big/100_Saransh Goila.jpg,1,"Chef, Entrepreneur, TV anchor","Saransh Goila won a cooking game show in 2011, and has risen in the chef ranks since. Now the founder of an eponymous quick-serve chain called Goila Butter Chicken, Goila appeared as a guest judge on Masterchef Australia, challenging contestants to recreate his signature butter chicken dish. Goila holds a record for the 'Longest road journey by a chef', travelling across India to discover regional cuisines, for 100 days. With a large social media following, Goila, who champions Indian food, has also been the face of brands such as Cinepolis, Alpenliebe and Samsung Galaxy. ","TV, Endorsements"
